url,question,reference_answer
https://www.pghcitypaper.com/pittsburgh/northside-digital-literacy-class/Event?oid=26744493,What is the name of the workforce development program that offers the Northside Digital Literacy Class?,WIN Workforce Development Program
https://www.pghcitypaper.com/pittsburgh/northside-digital-literacy-class/Event?oid=26744493,What is the goal of the Northside Digital Literacy Class?,to remove employment barriers and find sustainable employment
https://www.pghcitypaper.com/pittsburgh/tuesday-night-bingo-at-st-ursula-church/Event?oid=27548938,What is the name of the church hosting the weekly Tuesday night bingo in Pittsburgh?,St. Ursula Church
https://www.pghcitypaper.com/pittsburgh/tuesday-night-bingo-at-st-ursula-church/Event?oid=27548938,What is the name of the weekly $500 jackpot at the Tuesday night bingo in Pittsburgh?,Weekly $500 jackpot
https://www.pghcitypaper.com/pittsburgh/tuesday-night-bingo-at-st-ursula-church/Event?oid=27548938,What is the name of the social hall at St. Ursula Church where the Tuesday night bingo is held?,Social hall
https://www.pghcitypaper.com/pittsburgh/tuesday-night-bingo-at-st-ursula-church/Event?oid=27548938,What is the name of the Pittsburgh neighborhood where St. Ursula Church is located?,Allison Park
https://www.pghcitypaper.com/pittsburgh/tuesday-night-bingo-at-st-ursula-church/Event?oid=27548938,What is the name of the road where St. Ursula Church is located?,Kirk Ave
https://carnegiemuseums.org/carnegie-magazine/winter-2024/doug-genovese,What is the name of the magazine that published the Q&A with Doug Genovese?,Carnegie magazine
https://carnegiemuseums.org/carnegie-magazine/winter-2024/doug-genovese,How many visitors dine at the Carnegie Museums in Oakland every year?,"more than 100,000"
https://carnegiemuseums.org/carnegie-magazine/winter-2024/doug-genovese,What is the name of the cafe where Doug Genovese serves as the general manager of food and beverage services?,The Cafe Carnegie
https://carnegiemuseums.org/carnegie-magazine/winter-2024/doug-genovese,What is the name of the farm that has been instrumental in helping Doug Genovese find and connect with local chefs?,Churchview Farm
https://carnegiemuseums.org/carnegie-magazine/winter-2024/doug-genovese,What is the name of the catering company that Doug Genovese is partnering with in 2022?,Above and Beyond Catering
https://www.britannica.com/topic/afl-cio,Who was the president of the AFL-CIO in 1979?,Lane Kirkland
https://www.britannica.com/topic/afl-cio,What was the name of the federation formed in 1935 by representatives of eight unions?,Committee for Industrial Organization (CIO)
https://www.britannica.com/topic/afl-cio,In what year did the AFL and the CIO merge?,1955
https://www.britannica.com/topic/afl-cio,Who was the first person of colour to be elected to an AFL-CIO executive office in 1995?,Linda Chavez-Thompson
https://www.pghcitypaper.com/pittsburgh/guided-meditation/Event?oid=16784570,What is the name of the weekly hour of mindfulness in Pittsburgh?,Guided Meditation
https://www.pghcitypaper.com/pittsburgh/guided-meditation/Event?oid=16784570,What is the name of the astrologer who leads the meditations?,Chey of Smoky Quartz Magick & Divination
https://www.pghcitypaper.com/pittsburgh/guided-meditation/Event?oid=16784570,What is the address of the Thrive on Health studio?,"730 Brookline Boulevard, Pittsburgh"
https://www.pghcitypaper.com/pittsburgh/guided-meditation/Event?oid=16784570,What is the name of the library located near the Brookline Pub?,"Carnegie Library, Brookline"
https://www.pghcitypaper.com/pittsburgh/guided-meditation/Event?oid=16784570,What is the name of the street where the Market Women of Diamond Square takes place?,Diamond Square
https://www.post-gazette.com/local/city/2010/05/25/mellon-arena-roof-may-open-for-final-show/stories/201005250282,What was the name of the first act that performed at Mellon Arena?,Ice Capades
https://www.post-gazette.com/local/city/2010/05/25/mellon-arena-roof-may-open-for-final-show/stories/201005250282,What is the name of the new arena that Mellon Arena is being replaced by?,Consol Energy Center
https://www.post-gazette.com/local/city/2010/05/25/mellon-arena-roof-may-open-for-final-show/stories/201005250282,Who is the acting Pittsburgh police chief that has been in the news recently?,Ed Gainey
https://www.post-gazette.com/local/city/2010/05/25/mellon-arena-roof-may-open-for-final-show/stories/201005250282,What is the name of the Pittsburgh university that has a research center that was spared from an NIH funding cut?,Carnegie Mellon University
https://www.post-gazette.com/local/city/2010/05/25/mellon-arena-roof-may-open-for-final-show/stories/201005250282,What is the name of the Pittsburgh sports team that has a player named Rickard Rakell?,Penguins
https://www.pittsburghpa.gov/recreation-events/parks/community-garden-plots,What is the name of the community garden located in Beechview?,Beechview Community Garden
https://www.pittsburghpa.gov/recreation-events/parks/community-garden-plots,Which community garden has over 75 in-ground plots of various sizes?,Bandi Schaum Community Garden
https://www.pittsburghpa.gov/recreation-events/parks/community-garden-plots,What is the name of the street in Highland Park where the Highland Park Community Garden is located?,Stanton Ave
https://www.pittsburghpa.gov/recreation-events/parks/community-garden-plots,"What is the name of the university that is located in Pittsburgh, PA?",Carnegie Mellon University
https://trustarts.org/pct_home/privacy-policy,What is the name of the district in Pittsburgh where the Pittsburgh Cultural Trust is located?,The Cultural District
https://trustarts.org/pct_home/privacy-policy,Which Pittsburgh Cultural Trust venue is home to the Pittsburgh Ballet Theatre?,August Wilson Center
https://trustarts.org/pct_home/privacy-policy,What is the name of the organization that operates the August Wilson Center for African American Culture?,The Pittsburgh Cultural Trust
https://trustarts.org/pct_home/privacy-policy,What is the name of the organization that manages the Pittsburgh Cultural Trust?,The Pittsburgh Cultural Trust
https://trustarts.org/pct_home/events/groups/special-events,What is the name of the theater where the event 'WHO'S AFRAID OF VIRGINIA WOOLF?' takes place?,O'Reilly Theater
https://trustarts.org/pct_home/events/groups/special-events,Which university is mentioned as a partner in the University Student/Faculty Tickets section?,Carnegie Mellon University
https://trustarts.org/pct_home/events/groups/special-events,What is the name of the festival that takes place in the Cultural District?,Gallery Crawl
https://trustarts.org/pct_home/events/groups/special-events,What is the name of the festival that takes place on New Year's Eve?,Highmark First Night Pittsburgh
https://trustarts.org/pct_home/events/groups/special-events,What is the name of the company that presents the 'Trust Cabaret' event?,Dentons Cohen & Grigsby
https://www.pghcitypaper.com/pittsburgh/eventsearch?page=3&v=d,What is the name of the organization that provides volunteer opportunities to serve teenage mothers and their children in Pittsburgh?,YoungLives
https://www.pghcitypaper.com/pittsburgh/eventsearch?page=3&v=d,"What is the name of the gallery that is searching for glass artists, fiber artists, potters, etc. to compliment the exhibits for 2015 & 2016?",Boulevard Gallery & Different Strokes Gallery
https://www.wikidata.org/wiki/q1342#identifiers,What is the name of the Pittsburgh University that is known for its computer science program?,Carnegie Mellon University
https://downtownpittsburgh.com/do-business/paris-to-pittsburgh,What is the name of the matching grant program to assist property and business owners with exterior enhancements in Pittsburgh?,Paris to Pittsburgh
https://downtownpittsburgh.com/do-business/paris-to-pittsburgh,What is the name of the 50 percent matching grant offered to properties that are interested in façade improvements but are not adding an outdoor café or installing an operable storefront?,Façade Grant
https://downtownpittsburgh.com/do-business/paris-to-pittsburgh,What is the name of the committee that reviews applications for the Paris to Pittsburgh program?,Paris to Pittsburgh Advisory Committee
https://downtownpittsburgh.com/do-business/paris-to-pittsburgh,What is the maximum amount of the Sidewalk Activation Grant offered by the Paris to Pittsburgh program?,"$50,000"
https://downtownpittsburgh.com/do-business/paris-to-pittsburgh,Where is the Pittsburgh Downtown Partnership located?,The Bank Tower 307 Fourth Avenue – Floor 2
https://carnegiemuseums.org/carnegie-magazine/winter-2024/opening-up-the-world-for-others,What is the name of the exhibition planned for 2026 at the Carnegie Museum of Natural History?,Egypt on the Nile
https://carnegiemuseums.org/carnegie-magazine/winter-2024/opening-up-the-world-for-others,What is the name of the program that offers free programming and memberships for refugee families at the Carnegie Museum of Art?,Neighborhood Museum
https://carnegiemuseums.org/carnegie-magazine/winter-2024/opening-up-the-world-for-others,What is the name of the philanthropic giving program that Bob Fierst is a part of at Carnegie Museums?,Patrons Circle
https://carnegiemuseums.org/carnegie-magazine/winter-2024/opening-up-the-world-for-others,What is the name of the wholesale flooring distributor that Bob Fierst's family business is involved in?,Fierst Floor Covering
https://carnegiemuseums.org/carnegie-magazine/winter-2024/opening-up-the-world-for-others,What is the name of the museum that is home to the Hall of Architecture where the large plaster casts of ancient buildings are?,Carnegie Museum of Natural History
https://bananasplitfest.com,What is the official dessert of Pennsylvania?,The Banana Split
https://bananasplitfest.com,Where is the Great American Banana Split Celebration held?,Latrobe
https://bananasplitfest.com,What is the name of the festival that celebrates the Banana Split?,The Great American Banana Split Celebration
https://bananasplitfest.com,In what year did the Great American Banana Split Festival start in Latrobe?,2013
https://bananasplitfest.com,Who is credited with inventing the Banana Split in 1904?,David Strickler
https://www.hydrol-earth-syst-sci.net/11/1633/2007/hess-11-1633-2007.html,What is the name of the climate classification system used in the provided document?,Köppen-Geiger system
https://www.hydrol-earth-syst-sci.net/11/1633/2007/hess-11-1633-2007.html,What is the name of the university mentioned in the document as being in Pittsburgh?,Carnegie Mellon University
https://www.hydrol-earth-syst-sci.net/11/1633/2007/hess-11-1633-2007.html,"What is the name of the river that runs through Pittsburgh, according to the document?",Not mentioned in the document
https://www.hydrol-earth-syst-sci.net/11/1633/2007/hess-11-1633-2007.html,Who is the author of the document?,"M. C. Peel, B. L. Finlayson, and T. A. McMahon"
https://www.hydrol-earth-syst-sci.net/11/1633/2007/hess-11-1633-2007.html,What is the name of the city mentioned in the document as being the location of Carnegie Mellon University?,Pittsburgh
https://www.pghcitypaper.com/pittsburgh/the-all-new-rhythm-of-the-dance-show-is-a-two-hour-dance-show-with-large-cast-of-step-dancers-and-music-extravaganza-of-irish-singers-coming/Event?oid=27513349,What is the name of the dance show coming to The Palace Theatre in March 2025?,Rhythm of the Dance
https://www.pghcitypaper.com/pittsburgh/the-all-new-rhythm-of-the-dance-show-is-a-two-hour-dance-show-with-large-cast-of-step-dancers-and-music-extravaganza-of-irish-singers-coming/Event?oid=27513349,What is the name of the production company that is presenting the Rhythm of the Dance show?,Latshaw Productions
https://www.pghcitypaper.com/pittsburgh/the-all-new-rhythm-of-the-dance-show-is-a-two-hour-dance-show-with-large-cast-of-step-dancers-and-music-extravaganza-of-irish-singers-coming/Event?oid=27513349,What is the location of The Palace Theatre where the Rhythm of the Dance show will be held?,"21 W. Otterman St, Greensburg, PA 15601"
https://www.pghcitypaper.com/pittsburgh/the-all-new-rhythm-of-the-dance-show-is-a-two-hour-dance-show-with-large-cast-of-step-dancers-and-music-extravaganza-of-irish-singers-coming/Event?oid=27513349,What is the name of the theatre where the Rhythm of the Dance show will be held?,The Palace Theatre
https://web.archive.org/web/20120401112817/http://www.emporis.com/building/us-steel-tower-pittsburgh-pa-usa,What is the name of the building that was considered to be the world's tallest building outside of New York and Chicago at the time of its completion?,U.S. Steel Tower
https://web.archive.org/web/20120401112817/http://www.emporis.com/building/us-steel-tower-pittsburgh-pa-usa,What is the name of the famous plaza available to the public near U.S. Steel Tower?,Plaza
https://web.archive.org/web/20120401112817/http://www.emporis.com/building/us-steel-tower-pittsburgh-pa-usa,What is the name of the city in which Carnegie Mellon University is located?,Pittsburgh
https://web.archive.org/web/20120401112817/http://www.emporis.com/building/us-steel-tower-pittsburgh-pa-usa,In what year was the U.S. Steel Tower completed?,1970
https://web.archive.org/web/20120401112817/http://www.emporis.com/building/us-steel-tower-pittsburgh-pa-usa,What is the name of the company that was the first to use liquid-fireproofed columns in building construction?,U.S. Steel Corporation
https://bananasplitfest.com/events/5k-banana-run,"What is the name of the festival in Latrobe, PA that celebrates the banana split?",The Great American Banana Split Celebration
https://bananasplitfest.com/events/5k-banana-run,What is the name of the 5K race that takes place during the Great American Banana Split Celebration?,The 5K Banana Run
https://bananasplitfest.com/events/5k-banana-run,Where does the 5K Banana Run course wind through?,"historic downtown Latrobe, PA"
https://bananasplitfest.com/events/5k-banana-run,Who is the sponsor of the 5K Banana Run?,Dole
https://bananasplitfest.com/events/5k-banana-run,What is the name of the organization that hosts the Great American Banana Split Celebration?,Greater Latrobe-Laurel Valley Regional Chamber of Commerce
https://www.pittsburghpa.gov/safety/public-safety/violence-prevention,What is the name of the trust fund established in 2020 to support violence prevention efforts in Pittsburgh?,STOP the Violence Trust Fund
https://www.pittsburghpa.gov/safety/public-safety/violence-prevention,What is the name of the Pittsburgh Plan announced by Mayor Gainey in 2022?,Pittsburgh Plan for Peace
https://www.pittsburghpa.gov/safety/public-safety/violence-prevention,Which organization is part of the City of Pittsburgh Department of Public Safety but is not the Pittsburgh Bureau of Police?,STOP the Violence Office
https://www.pittsburghpa.gov/safety/public-safety/violence-prevention,"What is the name of the initiative that promotes, assists, and connects anti-violence activities sponsored by the City of Pittsburgh with other governmental and private anti-violence activities?",Group Violence Intervention (GVI)
https://www.pittsburghpa.gov/safety/public-safety/violence-prevention,What is the name of the program that helps to prevent violence by providing resources and support to individuals and communities?,STOP the Violence Community Investment Grant
https://www.pghcitypaper.com/pittsburgh/trapt-full-band-acoustic-tour/Event?oid=27541538,What is the name of the winery that hosts the Trapt - Full Band Acoustic Tour?,The Forge Urban Winery
https://www.pghcitypaper.com/pittsburgh/trapt-full-band-acoustic-tour/Event?oid=27541538,What is the name of the city where The Forge Urban Winery is located?,Homestead Greensburg
https://www.pghcitypaper.com/pittsburgh/trapt-full-band-acoustic-tour/Event?oid=27541538,What is the name of the event that welcomes TRAPT - FULL BAND ACOUSTIC TOUR with special guest BLOOMFIELD?,The Forge Urban Winery and CE Presents
https://www.pghcitypaper.com/pittsburgh/trapt-full-band-acoustic-tour/Event?oid=27541538,What is the name of the street where The Forge Urban Winery is located?,E 7th Ave
https://www.pghcitypaper.com/pittsburgh/trapt-full-band-acoustic-tour/Event?oid=27541538,What is the year when Trapt - Full Band Acoustic Tour will take place?,2025
https://www.steelers.com/tickets/season-tickets-waiting-list,How many postseason games do season ticket holders have first right of refusal to?,"Postseason games are not a required purchase, but season ticket holders have first right of refusal to their seat location for any postseason games."
https://www.steelers.com/tickets/season-tickets-waiting-list,What is the cost of a seat license in the 500-level licensed seating?,"$1,250"
https://www.steelers.com/tickets/season-tickets-waiting-list,What is the name of the marketplace where fans can purchase stadium seat licenses from current season ticket holders?,Seat License Marketplace
https://www.steelers.com/tickets/season-tickets-waiting-list,What is the required purchase for all licensed seat locations within Acrisure Stadium?,A seat license fee
https://fred.stlouisfed.org/series/rgmp38300,"What is the name of the economic indicator that measures the total real gross domestic product for Pittsburgh, PA (MSA)?","Total Real Gross Domestic Product for Pittsburgh, PA (MSA)"
https://fred.stlouisfed.org/series/rgmp38300,"What year was the last data update for the Total Real Gross Domestic Product for Pittsburgh, PA (MSA)?","Dec 4, 2024"
https://fred.stlouisfed.org/series/rgmp38300,"What is the name of the organization that provides the data for the Total Real Gross Domestic Product for Pittsburgh, PA (MSA)?",U.S. Bureau of Economic Analysis
https://www.pghcitypaper.com/category/infrastructure-22045766,What is the name of the Pittsburgh publication that uses cookies to understand user behavior?,Pittsburgh City Paper
https://www.pghcitypaper.com/category/infrastructure-22045766,In what year was Icelandair's direct flight from Pittsburgh introduced?,2024
https://www.pghcitypaper.com/category/infrastructure-22045766,What is the name of the park in Pittsburgh that is home to a fountain that has been a symbol of the city for 50 years?,Point State Park
https://www.pghcitypaper.com/category/infrastructure-22045766,What is the name of the organization that has an ambitious vision for expanded public transit service in Pittsburgh?,Pittsburghers for Public Transit
https://www.pghcitypaper.com/category/infrastructure-22045766,What is the name of the comedy club in Pittsburgh that hosts a benefit show?,Arcade Comedy Theater
https://www.pittsburghpa.gov/resident-services/ada-disability-rights/faqs,What is the name of the famous football stadium located in Pittsburgh?,Acrisure Stadium
https://www.pittsburghpa.gov/resident-services/ada-disability-rights/faqs,Which of the following is a notable event that occurred in Pittsburgh?,The G-20 Pittsburgh summit
https://www.pittsburghpa.gov/resident-services/ada-disability-rights/faqs,What is the name of the university that is known for its computer science and robotics programs?,Carnegie Mellon University
https://sports.bluesombrero.com/default.aspx?tabid=521554,What is the name of the stadium where the Steelers preseason game takes place?,Acrisure Stadium
https://sports.bluesombrero.com/default.aspx?tabid=521554,What is the name of the university that is home to the famous AI professor Luis von Ahn?,Carnegie Mellon University
https://sports.bluesombrero.com/default.aspx?tabid=521554,In what year will the Steelers Youth Football Camps take place?,2025
https://sports.bluesombrero.com/default.aspx?tabid=521554,How many tickets to a Steelers home preseason game do campers receive?,2
https://www.pittsburghpa.gov/safety/fire/bureau-of-fire-contacts,What is the name of the mayor of Pittsburgh in 2025?,Not available in the given document
https://www.pittsburghpa.gov/safety/fire/bureau-of-fire-contacts,What is the name of the department that handles Fire in Pittsburgh?,Bureau of Fire
https://www.pittsburghpa.gov/safety/fire/bureau-of-fire-contacts,What is the name of the Fire Chief in Pittsburgh?,Darryl E. Jones
https://www.pittsburghpa.gov/safety/fire/bureau-of-fire-contacts,What is the address of the Fire Headquarters in Pittsburgh?,"2945 Railroad Street Pittsburgh, PA 15201"
https://www.pittsburghpa.gov/safety/fire/bureau-of-fire-contacts,What is the name of the program that offers Fire Safety in Pittsburgh?,Fire Safety Programs
