url,question,reference_answer
https://www.heinzhistorycenter.org/event/history-uncorked-2025,"What is the name of the company that provides open bar courtesy of Wigle Whiskey, Pennsylvania Libations, and Penn Brewery at the VIP reception of History Uncorked?",Wigle Whiskey
https://www.heinzhistorycenter.org/event/history-uncorked-2025,What is the name of the event chair for History Uncorked in 2025?,Laura Early
https://www.cmu.edu/engage/give/donor-recognition/index.html,What is the name of the highest giving society at Carnegie Mellon University?,The Highlands Circle
https://www.cmu.edu/engage/give/donor-recognition/index.html,What is the name of the college-based giving society at the Tepper School of Business?,W.L. Mellon Society
https://www.cmu.edu/engage/give/donor-recognition/index.html,Where is the University Advancement office located?,"5000 Forbes Ave, Pittsburgh, PA 15213"
https://www.cmu.edu/engage/give/donor-recognition/index.html,"What is the name of the giving society for donors who contribute $100,000 to $999,999 to the university?",The Dunfermline Circle
https://www.cmu.edu/engage/give/donor-recognition/index.html,What is the name of the donor recognition society for dedicated donors who give to CMU for every year?,Order of the May
https://www.pghcitypaper.com/pittsburgh/free-throws-and-field-goals-sports-trivia-night/Event?oid=27543184,What is the name of the annual fundraising event held at PNC Park in Pittsburgh?,Free Throws & Field Goals Sports Trivia Night
https://www.pghcitypaper.com/pittsburgh/free-throws-and-field-goals-sports-trivia-night/Event?oid=27543184,What is the name of the organization that hosts the annual fundraising event?,Jewish Federation of Greater Pittsburgh's YAD Philanthropy
https://www.pghcitypaper.com/pittsburgh/free-throws-and-field-goals-sports-trivia-night/Event?oid=27543184,What is the name of the sports team that hosts the sports trivia night at PNC Park?,Pittsburgh Pirates
https://www.pghcitypaper.com/pittsburgh/free-throws-and-field-goals-sports-trivia-night/Event?oid=27543184,What is the name of the river that runs along the North Shore of Pittsburgh?,Allegheny River
https://www.pghcitypaper.com/pittsburgh/free-throws-and-field-goals-sports-trivia-night/Event?oid=27543184,What is the name of the university that is mentioned in the article as being located in Pittsburgh?,Carnegie Mellon University
https://www.pghcitypaper.com/pittsburgh/marchs-keg-tapping-celebration/event?oid=27527083,What is the name of the lager being tapped at Hofbrauhaus Pittsburgh?,Märzen
https://www.pghcitypaper.com/pittsburgh/marchs-keg-tapping-celebration/event?oid=27527083,"What is the name of the restaurant located at 2705 S. Water Street, Pittsburgh?",Hofbrauhaus Pittsburgh Brewery & Restaurant
https://www.pghcitypaper.com/pittsburgh/marchs-keg-tapping-celebration/event?oid=27527083,What is the name of the festival being celebrated at Hofbrauhaus Pittsburgh?,March's Keg Tapping Celebration
https://www.pghcitypaper.com/pittsburgh/marchs-keg-tapping-celebration/event?oid=27527083,What is the ABV of Märzen?,5.8%
https://www.pghcitypaper.com/pittsburgh/marchs-keg-tapping-celebration/event?oid=27527083,What is the name of the university that the AI professor Luis von Ahn is affiliated with?,Carnegie Mellon University
https://trustarts.org/pct_home/support/planned-giving/contact-us-for-planned-giving,What is the name of the organization that manages the cultural and arts events in Pittsburgh?,The Pittsburgh Cultural Trust
https://trustarts.org/pct_home/support/planned-giving/contact-us-for-planned-giving,What is the name of the major gifts officer at the Pittsburgh Cultural Trust?,Allie Fetchko
https://trustarts.org/pct_home/support/planned-giving/contact-us-for-planned-giving,What is the address of the Pittsburgh Cultural Trust headquarters?,"803 Liberty Avenue, Pittsburgh, PA 15222"
https://trustarts.org/pct_home/support/planned-giving/contact-us-for-planned-giving,What is the name of the street in Pittsburgh where the Pittsburgh Cultural Trust headquarters is located?,Liberty Avenue
https://trustarts.org/pct_home/support/planned-giving/contact-us-for-planned-giving,What is the federal tax ID number of the Pittsburgh Cultural Trust?,Please contact us for our federal tax ID number
https://www.pghcitypaper.com/arts-entertainment,What is the name of the university that is featured in the article about Pittsburgh?,Carnegie Mellon University
https://www.pghcitypaper.com/arts-entertainment,What is the name of the local film restoration project launched by Pittsburgh Sound + Image?,restore local film treasures
https://www.pghcitypaper.com/arts-entertainment,What is the name of the children's book that challenges harmful notions of 'good hair'?,Helen Smith's children's book
https://www.pghcitypaper.com/arts-entertainment,What is the name of the local artist who created an interactive app to preserve Pittsburgh's Black history?,Tara Fay Coleman
https://www.pghcitypaper.com/arts-entertainment,What is the name of the Pittsburgh basketball legend who had an extraordinary life and death?,John Brisker
https://www.cmu.edu/engage/alumni/about/aab/index.html,What is the name of the board that oversees the Carnegie Mellon University Alumni Association?,The CMU Alumni Association Board
https://www.cmu.edu/engage/alumni/about/aab/index.html,What is the name of the annual conference hosted by Carnegie Mellon University that features world-class innovators?,Frontiers Conference
https://www.cmu.edu/engage/alumni/about/aab/index.html,What is the name of the university's first-ever Presidents Athletics Conference Championship in women's basketball won by Lisa Lightner Georgiana's team in 1989?,Presidents Athletics Conference Championship
https://www.cmu.edu/engage/alumni/about/aab/index.html,What is the name of the student group founded by Justin Cole in 2015 that aims to bring together students from all of the colleges that CMU has?,Students Using Data Science for Social Good
https://trustarts.org/blog/bookish-in-the-burgh-holiday-gift-guide,What is the name of the festival presented by Riverstone Books?,Bookish in the 'Burgh
https://trustarts.org/blog/bookish-in-the-burgh-holiday-gift-guide,In which year was the festival's Teen Day registration opened?,January 31st
https://trustarts.org/blog/bookish-in-the-burgh-holiday-gift-guide,What is the name of the independent bookstore that is the presenting sponsor of the festival?,Riverstone Books
https://trustarts.org/blog/bookish-in-the-burgh-holiday-gift-guide,What is the name of the city where the festival is held?,Pittsburgh
https://trustarts.org/blog/bookish-in-the-burgh-holiday-gift-guide,What is the name of the university where the Teen Ambassador Layla K. is a student?,Carnegie Mellon University
https://carnegiemuseums.org/join-support,What is the name of the largest of the four Carnegie Museums?,Carnegie Science Center
https://carnegiemuseums.org/join-support,What is the name of the famous museum in Pittsburgh that is dedicated to the life and art of Andy Warhol?,The Andy Warhol Museum
https://carnegiemuseums.org/join-support,What is the name of the museum in Pittsburgh that is home to over 20 million specimens and objects?,Carnegie Museum of Natural History
https://carnegiemuseums.org/join-support,What is the name of the membership level that offers free reciprocal admission to other museums and science centers across the country?,Choose from among five membership levels
https://carnegiemuseums.org/join-support,What is the name of the university that is home to the Carnegie Mellon University?,Carnegie Mellon University
https://www.pghcitypaper.com/pittsburgh/slideshowarchives,What is the name of the building in downtown Pittsburgh where protesters gathered to stand up for democracy?,William S. Moorhead building
https://www.pghcitypaper.com/pittsburgh/slideshowarchives,What is the name of the event where Pirates fans and pierogies flooded the David L. Lawrence Convention Center?,PiratesFest 2025
https://www.pghcitypaper.com/pittsburgh/slideshowarchives,Which street in Pittsburgh is home to Primanti Bros. locations where the Pirates Pierogies crashed?,Smithfield Street
https://www.pghcitypaper.com/pittsburgh/slideshowarchives,"What is the name of the drag show celebrating Tim Robinson's wild sketch comedy series, I Think You Should Leave?",I Think You Should Tease
https://www.pghcitypaper.com/pittsburgh/slideshowarchives,What is the name of the charity that runners participated in during the 12th annual Cupid's Undie Run?,Charity
https://trustarts.org/pct_home/support/donor-resources/donor-presale-access,What is the name of the cultural organization that offers donor presale access to events in Pittsburgh?,Pittsburgh Cultural Trust
https://trustarts.org/pct_home/support/donor-resources/donor-presale-access,What is the phone number for accessing donor presales by phone?,412-456-6666
https://trustarts.org/pct_home/support/donor-resources/donor-presale-access,What is the name of the website where one can access donor presales online?,TrustArts.org
https://trustarts.org/pct_home/support/donor-resources/donor-presale-access,What is the name of the program that allows donors to purchase tickets before they go on sale to the general public?,Donor Presale Access
https://trustarts.org/pct_home/support/donor-resources/donor-presale-access,What is the name of the donor support line for any questions about accessing donor presales?,412-471-3518
https://trustarts.org/blog/six-cant-miss-spots-at-the-fall-gallery-crawl,What event in the Cultural District brings everyone together to celebrate local art?,The Fall Gallery Crawl
https://trustarts.org/blog/six-cant-miss-spots-at-the-fall-gallery-crawl,Where will you find the Community Canvas in the Cultural District?,Exchange Way
https://trustarts.org/blog/six-cant-miss-spots-at-the-fall-gallery-crawl,Which artist designed the murals for the Community Canvas?,Alison Zapata
https://trustarts.org/blog/six-cant-miss-spots-at-the-fall-gallery-crawl,What is the name of the installation at Wood Street Galleries that investigates the Arctic Circle and its rapid disappearance?,Boat Trip
https://trustarts.org/blog/six-cant-miss-spots-at-the-fall-gallery-crawl,Who is the director of the movie 'The Last Dragon'?,Michael Schultz
https://downtownpittsburgh.com/events/event?id=62445,What is the name of the stadium where the Pittsburgh Penguins play?,PPG Paints Arena
https://downtownpittsburgh.com/events/event?id=62445,What is the name of the development project that is transforming a vacant lot in downtown Pittsburgh into a vibrant public space?,Project Pop-Up Paris to Pittsburgh
https://downtownpittsburgh.com/events/event?id=62445,Who is the current CEO of the Pittsburgh Downtown Partnership?,Not mentioned in the document
https://downtownpittsburgh.com/events/event?id=62445,What is the name of the university that is mentioned in the document and is located in Pittsburgh?,Carnegie Mellon University
https://www.nhl.com/gamecenter/stl-vs-pit/2025/03/13/2024021044,What is the name of the NHL team based in Pittsburgh?,Pittsburgh Penguins
https://www.nhl.com/gamecenter/stl-vs-pit/2025/03/13/2024021044,Who is the current coach of the Pittsburgh Penguins?,Mike Sullivan
https://www.nhl.com/gamecenter/stl-vs-pit/2025/03/13/2024021044,What is the name of the arena where the Pittsburgh Penguins play their home games?,PPG Paints Arena
https://trustarts.org/blog/ways-to-support-black-art-in-the-cultural-district,What is the name of the theater where Eric Jones will perform his new magic show?,Liberty Magic
https://trustarts.org/blog/ways-to-support-black-art-in-the-cultural-district,Which Pittsburgh Cultural Trust program showcases hundreds of jazz greats from the region?,BNY Mellon Presents JazzLive series
https://trustarts.org/blog/ways-to-support-black-art-in-the-cultural-district,"What percentage of magicians in the U.S. were identified as African American as of December, 2021?",10%
https://trustarts.org/blog/ways-to-support-black-art-in-the-cultural-district,Which artist and Collective founder curated the exhibit 'InVisible'?,Natiq Jalil
https://trustarts.org/blog/ways-to-support-black-art-in-the-cultural-district,What is the name of the film directed by Skinny Meyers that tells the story of a young Black man in America facing racially charged incidents?,The Sleeping Negro
https://pittsburghquarterly.com/articles/pittsburgh-operas-armida-sings-in-a-language-beyond-words,What is the name of the opera that was performed by Pittsburgh Opera in 2025?,Armida
https://pittsburghquarterly.com/articles/pittsburgh-operas-armida-sings-in-a-language-beyond-words,Who is the director of the Pittsburgh Opera Orchestra in the performance of Armida?,Anthony Walker
https://pittsburghquarterly.com/articles/pittsburgh-operas-armida-sings-in-a-language-beyond-words,What is the name of the French New Wave director mentioned in the article as an example of a director who did not require sound for his films to be understood?,Francois Truffaut
https://pittsburghquarterly.com/articles/pittsburgh-operas-armida-sings-in-a-language-beyond-words,What is the name of the Austrian composer who wrote the opera Armida in 1784?,Franz Joseph Haydn
https://pittsburghquarterly.com/articles/pittsburgh-operas-armida-sings-in-a-language-beyond-words,What is the name of the venue where the performance of Armida took place?,CAPA School Theater
https://events.cmu.edu/submit,What is the name of the university's web login page?,login.cmu.edu
https://events.cmu.edu/submit,When was Carnegie Mellon University founded?,1900
https://events.cmu.edu/submit,Who is the AndrewID and password login page warning addressed to?,it-help@cmu.edu
https://www.britannica.com/biography/john-forbes,In what year did John Forbes lead a new advance upon Fort Duquesne?,1758
https://www.britannica.com/biography/john-forbes,What is the name of the fortress that General John Forbes seized in 1759?,Fort Duquesne
https://www.britannica.com/biography/john-forbes,What is the name of the road that General John Forbes cut across Pennsylvania?,Braddock's road
https://www.britannica.com/biography/john-forbes,What is the name of the fort that the British built in 1761 to ensure their dominance at the source of the Ohio?,Fort Pitt
https://www.britannica.com/biography/john-forbes,Who was the British statesman that General John Forbes named the site after?,William Pitt the Elder
https://www.pittsburghpa.gov/safety/office-of-community-health-and-safety/meet-the-staff,Who is the founder of Carnegie Mellon University?,Andrew Carnegie
https://www.pittsburghpa.gov/safety/office-of-community-health-and-safety/meet-the-staff,What is the name of the famous street in Pittsburgh known for its arts and culture scene?,Carnegie Street
https://www.pittsburghpa.gov/safety/office-of-community-health-and-safety/meet-the-staff,What is the name of the research university located in Pittsburgh?,Carnegie Mellon University
https://www.pittsburghpa.gov/safety/office-of-community-health-and-safety/meet-the-staff,Who is the current mayor of Pittsburgh?,Ed Gainey
https://www.pittsburghpa.gov/business-development/city-planning,What is the name of the city government department that oversees city planning in Pittsburgh?,City Planning
https://www.pittsburghpa.gov/business-development/city-planning,What is the name of the program at CMU that ensures art and culture have a place in public spaces?,Public Art Program
https://www.pittsburghpa.gov/business-development/city-planning,What is the name of the Pittsburgh river that the Roberto Clemente Bridge spans?,Allegheny River
https://www.pittsburghpa.gov/business-development/city-planning,Who is the mayor of Pittsburgh as of 2025?,Not specified in the given document
https://www.pittsburghpa.gov/business-development/city-planning,"What is the name of the CMU initiative focused on promoting vibrant neighborhoods and a resilient, equitable future for all?",City Planning
https://www.visitpittsburgh.com/things-to-do/arts-culture,What is the name of the museum located on the Northside of Pittsburgh?,The Andy Warhol Museum
https://www.visitpittsburgh.com/things-to-do/arts-culture,What is the name of the architecture movement that Pittsburgh has become a leader in?,The green building movement
https://www.visitpittsburgh.com/things-to-do/arts-culture,What is the name of the festival that celebrates the arts in Pittsburgh?,Unblurred: First Fridays on Penn Avenue
https://www.visitpittsburgh.com/things-to-do/arts-culture,What is the name of the street in Pittsburgh where one can find the Unblurred festival?,Penn Avenue
https://www.visitpittsburgh.com/things-to-do/arts-culture,In what year was the Pittsburgh Insider's Guide first published?,2025
https://www.steelers.com/news/los-steelers-elegidos-para-jugar-el-primer-partido-de-temporada-regular-de-la-nfl-en-irlanda-en-2025,What is the name of the Pittsburgh Steelers' stadium?,Acrisure Stadium
https://www.steelers.com/news/los-steelers-elegidos-para-jugar-el-primer-partido-de-temporada-regular-de-la-nfl-en-irlanda-en-2025,"What is the name of the event that will be held in Dublin, Ireland in 2025?",NFL Dublin 2025
https://www.steelers.com/news/los-steelers-elegidos-para-jugar-el-primer-partido-de-temporada-regular-de-la-nfl-en-irlanda-en-2025,Who is the current president of the Pittsburgh Steelers?,Art Rooney II
https://www.steelers.com/news/los-steelers-elegidos-para-jugar-el-primer-partido-de-temporada-regular-de-la-nfl-en-irlanda-en-2025,"What is the name of the organization that Daniel M. Rooney, the former president of the Steelers, was a cofounder of?",The Ireland Funds
https://www.steelers.com/news/los-steelers-elegidos-para-jugar-el-primer-partido-de-temporada-regular-de-la-nfl-en-irlanda-en-2025,"What is the name of the stadium where the Steelers will play their game in Dublin, Ireland in 2025?",Croke Park
https://acrisurestadium.com/guest-services/security-guidelines,What is the name of the stadium in Pittsburgh where the Pittsburgh Steelers play?,Acrisure Stadium
https://acrisurestadium.com/guest-services/security-guidelines,In what year was the Pittsburgh Steelers team founded?,1933
https://acrisurestadium.com/guest-services/security-guidelines,What is the name of the museum located in Acrisure Stadium?,Steelers Hall of Honor Museum
https://acrisurestadium.com/guest-services/security-guidelines,What is the name of the private event space in Acrisure Stadium that offers audio/visual services?,FedEx Great Hall North Club
https://acrisurestadium.com/guest-services/security-guidelines,Who is the owner of the Pittsburgh Steelers team?,Acrisure
https://www.cmu.edu/engage/give/gift-planning/index.html,What is the name of the donor recognition society at Carnegie Mellon University?,The Warner Circle
https://www.cmu.edu/engage/give/gift-planning/index.html,In which city is Carnegie Mellon University located?,Pittsburgh
https://www.cmu.edu/engage/give/gift-planning/index.html,"What is the name of the fourth president of Carnegie Mellon University, after whom The Warner Circle is named?",John C. Warner
https://www.cmu.edu/engage/give/gift-planning/index.html,What is the tax ID number of Carnegie Mellon University?,25-0969449
https://www.cmu.edu/engage/give/gift-planning/index.html,What is the name of the university's online newsletter?,Tartan Traditions
https://www.pghcitypaper.com/pittsburgh/cv-theatre-presents-something-rotten-musical/event?oid=27572421,What is the name of the musical that CV Theatre is presenting?,Something Rotten!
https://www.pghcitypaper.com/pittsburgh/cv-theatre-presents-something-rotten-musical/event?oid=27572421,What is the name of the high school where the musical is being held?,Chartiers Valley High School
https://www.pghcitypaper.com/pittsburgh/cv-theatre-presents-something-rotten-musical/event?oid=27572421,What is the name of the street where Chartiers Valley High School is located?,Thoms Run Rd.
https://www.pghcitypaper.com/pittsburgh/cv-theatre-presents-something-rotten-musical/event?oid=27572421,What is the name of the city where CV Theatre is located?,Pittsburgh
https://www.pghcitypaper.com/pittsburgh/cv-theatre-presents-something-rotten-musical/event?oid=27572421,What is the name of the university that is mentioned in the document?,Carnegie Mellon University
https://trustarts.org/pct_home/events/series/liberty-magic,What is the name of the street where the administrative offices of the Pittsburgh Cultural Trust are located?,Liberty Avenue
https://trustarts.org/pct_home/events/series/liberty-magic,What is the name of the fund that supports Liberty Magic?,Emma Clyde Hodge Memorial Fund
https://trustarts.org/pct_home/events/series/liberty-magic,What is the phone number for the Pittsburgh Cultural Trust's administrative office?,412-471-6070
https://trustarts.org/pct_home/events/series/liberty-magic,What is the name of the theater that hosts Liberty Magic?,Liberty Magic
https://trustarts.org/pct_home/events/series/liberty-magic,What is the email address for the Pittsburgh Cultural Trust's administrative office?,Not provided in the given document
https://www.cmu.edu/engage/give/gift-planning/create-income.html,What is the name of the street where the Carnegie Mellon University University Advancement office is located?,Forbes Ave
https://www.cmu.edu/engage/give/gift-planning/create-income.html,Who is the contact person for the Gift Planning team at Carnegie Mellon University?,Mick Koster
https://www.cmu.edu/engage/give/gift-planning/create-income.html,What is the name of the university's YouTube channel?,CMU YouTube Channel
https://www.pittsburghpa.gov/city-government/finances-budget/taxes/tax-forms?oc_lang=pt,What is the name of the largest park in Pittsburgh?,Schenley Park
https://www.pittsburghpa.gov/city-government/finances-budget/taxes/tax-forms?oc_lang=pt,What is the name of the university's football team?,Tartans
https://www.pittsburghpa.gov/city-government/finances-budget/taxes/tax-forms?oc_lang=pt,Who is the mayor of Pittsburgh?,Ed Gainey
https://www.pittsburghpa.gov/city-government/finances-budget/taxes/tax-forms?oc_lang=pt,What is the name of the city's iconic sports stadium?,PNC Park
https://onlocationexp.com/nfl/super-bowl-tickets?utm_source=steelers.com&utm_medium=referral&utm_campaign=super_bowl_teams-steelers_footer_menu,What is the name of the city in Pennsylvania that is home to Carnegie Mellon University?,Pittsburgh
https://www.britannica.com/editor/amy-tikkanen/6393,Who is the American lawyer and politician who was chief of staff in the administration of U.S. Pres. Donald Trump?,Reince Priebus
https://www.britannica.com/editor/amy-tikkanen/6393,What is the name of the department of government efficiency that was a topic of discussion in 2025?,Department of Government Efficiency
https://www.britannica.com/editor/amy-tikkanen/6393,"What is the name of the famous lawyer and politician who grew up in Kenosha, Wisconsin?",Reince Priebus
https://downtownpittsburgh.com/events?n=3&d=17&y=2025,What is the name of the famous film festival held in Pittsburgh?,The Thaw
https://downtownpittsburgh.com/events?n=3&d=17&y=2025,What is the name of the historic jail turned museum in Downtown Pittsburgh?,The Old Allegheny County Jail and Museum
https://downtownpittsburgh.com/events?n=3&d=17&y=2025,What is the name of the public art space in Market Square?,Pub On The Square
https://downtownpittsburgh.com/events?n=3&d=17&y=2025,What is the name of the film that won the Silver Lion at the 2024 Venice Film Festival and is being screened at the Pittsburgh Downtown Partnership?,Vermiglio
https://downtownpittsburgh.com/events?n=3&d=17&y=2025,In what year was the Pittsburgh Downtown Partnership founded?,2015
https://www.pittsburghpa.gov/safety/animal-care-control/rodent-baiting-program,What is the name of the rodent baiting program in Pittsburgh?,Rodent Baiting Program
https://www.pittsburghpa.gov/safety/animal-care-control/rodent-baiting-program,What is the name of the contractor that places the pet-safe baiting station on a resident's property?,a contractor
https://www.pittsburghpa.gov/safety/animal-care-control/rodent-baiting-program,How many times per year can a resident request free rodent baiting?,two times per year
https://www.pittsburghpa.gov/safety/animal-care-control/rodent-baiting-program,What is the typical lifespan of a pet-safe baiting station?,about two months
https://www.pittsburghpa.gov/safety/animal-care-control/rodent-baiting-program,What should a resident report to PLI through 311 for inspection if they have issues creating or aggravating a rodent problem?,trash violations or poor property maintenance
https://3riversstudios.com,What is the name of the film and television studio located in Pittsburgh?,3 Rivers Studios
https://3riversstudios.com,How long does it take to get from downtown Pittsburgh to 3 Rivers Studios?,12 minutes
https://3riversstudios.com,What is the size of the building where 3 Rivers Studios is located?,"130,000 sq.ft."
https://3riversstudios.com,What services does 3 Rivers Studios offer in addition to its sound stages?,"set design and construction, wardrobe, special effects, catering, etc."
https://3riversstudios.com,What is the name of the in-house medic/specialist at 3 Rivers Studios?,COVID-19 trained medic/specialist
https://www.pghcitypaper.com/pittsburgh/northside-digital-literacy-class/Event?oid=26744493,What is the name of the digital literacy class offered by the WIN Workforce Development Program in collaboration with the NorthSide North Shore Chamber of Commerce?,Northside Digital Literacy Class
https://www.pghcitypaper.com/pittsburgh/northside-digital-literacy-class/Event?oid=26744493,Where is the Northside Digital Literacy Class held?,CoLab18 at Nova Place
https://www.pghcitypaper.com/pittsburgh/northside-digital-literacy-class/Event?oid=26744493,What is the address of CoLab18 at Nova Place?,"100 S. Commons, Pittsburgh North Side"
